FULL_ADDR,COUNTY,TOWN,VILLAGE,NEIGHBORHOOD,ROAD,SECTION,LANE,ALLEY,SUB_ALLEY,TONG,NUMBER,X,Y
宜蘭縣冬山鄉八寶村13鄰寶慶三路37巷11號,10002,1000208,1000208-012,13鄰,寶慶三路,,37巷,,,,11號,121.76052865974,24.635177730493
宜蘭縣冬山鄉八寶村13鄰寶慶三路37巷17號,10002,1000208,1000208-012,13鄰,寶慶三路,,37巷,,,,17號,121.7603857163,24.63492990427
宜蘭縣冬山鄉八寶村13鄰寶慶三路46號,10002,1000208,1000208-012,13鄰,寶慶三路,,,,,,46號,121.76078989699,24.63556616071
宜蘭縣冬山鄉八寶村13鄰寶慶三路50號,10002,1000208,1000208-012,13鄰,寶慶三路,,,,,,50號,121.76021234581,24.635742154237
宜蘭縣冬山鄉八寶村13鄰寶慶三路78號,10002,1000208,1000208-012,13鄰,寶慶三路,,,,,,78號,121.75965589429,24.635846805685
宜蘭縣冬山鄉八寶村13鄰寶慶三路80號,10002,1000208,1000208-012,13鄰,寶慶三路,,,,,,80號,121.75973442018,24.635944907712
