FULL_ADDR,COUNTY,TOWN,VILLAGE,NEIGHBORHOOD,ROAD,SECTION,LANE,ALLEY,SUB_ALLEY,TONG,NUMBER,X,Y
彰化縣溪湖鎮大庭里2鄰崙子腳路大庭巷13號,10007,1000711,1000711-022,2鄰,崙子腳路,,大庭巷,,,,13號,120.49890740929,23.951940148304
彰化縣溪湖鎮大庭里11鄰崙子腳路32號,10007,1000711,1000711-022,11鄰,崙子腳路,,,,,,32號,120.4982461471,23.948180005644
彰化縣溪湖鎮大庭里11鄰崙子腳路32之45號,10007,1000711,1000711-022,11鄰,崙子腳路,,,,,,32之45號,120.49813234109,23.948699935204
彰化縣溪湖鎮大庭里3鄰崙子腳路53號,10007,1000711,1000711-022,3鄰,崙子腳路,,,,,,53號,120.49520614034,23.948528258243
彰化縣溪湖鎮大庭里6鄰崙子腳路57號,10007,1000711,1000711-022,6鄰,崙子腳路,,,,,,57號,120.49484941874,23.948020626168
彰化縣溪湖鎮大庭里5鄰崙子腳路69號,10007,1000711,1000711-022,5鄰,崙子腳路,,,,,,69號,120.49370333421,23.947603576565
