FULL_ADDR,COUNTY,TOWN,VILLAGE,NEIGHBORHOOD,ROAD,SECTION,LANE,ALLEY,SUB_ALLEY,TONG,NUMBER,X,Y
宜蘭縣三星鄉大義村9鄰尚健五路二段2號,10002,1000210,1000210-015,9鄰,尚健五路,2段,,,,,2號,121.69299996121,24.683127806647
宜蘭縣三星鄉大義村11鄰尚健五路一段246巷3號,10002,1000210,1000210-015,11鄰,尚健五路,1段,246巷,,,,3號,121.69326388817,24.679983012761
宜蘭縣三星鄉大義村11鄰尚健五路一段246巷5號,10002,1000210,1000210-015,11鄰,尚健五路,1段,246巷,,,,5號,121.6933659509,24.679981638719
宜蘭縣三星鄉大義村11鄰尚健五路一段181號,10002,1000210,1000210-015,11鄰,尚健五路,1段,,,,,181號,121.6929813769,24.679086538916
宜蘭縣三星鄉大義村11鄰尚健五路一段207號,10002,1000210,1000210-015,11鄰,尚健五路,1段,,,,,207號,121.69288527665,24.680238185542
