FULL_ADDR,COUNTY,TOWN,VILLAGE,NEIGHBORHOOD,ROAD,SECTION,LANE,ALLEY,SUB_ALLEY,TONG,NUMBER,X,Y
新竹縣寶山鄉雙溪村6鄰園區三路99號,10004,1000410,1000410-001,6鄰,園區三路,,,,,,99號,121.00193263524,24.771774701284
新竹縣寶山鄉大崎村10鄰園區三路1號,10004,1000410,1000410-002,10鄰,園區三路,,,,,,1號,121.01007840951,24.772723539416
新竹縣寶山鄉大崎村10鄰園區三路3號,10004,1000410,1000410-002,10鄰,園區三路,,,,,,3號,121.00996066056,24.772556327525
新竹縣寶山鄉大崎村10鄰園區三路29巷22號,10004,1000410,1000410-002,10鄰,園區三路,,29巷,,,,22號,121.00791320241,24.77064538056
新竹縣寶山鄉大崎村10鄰園區三路29巷26號,10004,1000410,1000410-002,10鄰,園區三路,,29巷,,,,26號,121.00785265305,24.770621918259
新竹縣寶山鄉大崎村10鄰園區三路29巷28號,10004,1000410,1000410-002,10鄰,園區三路,,29巷,,,,28號,121.00774389531,24.770574333854
