FULL_ADDR,COUNTY,TOWN,VILLAGE,NEIGHBORHOOD,ROAD,SECTION,LANE,ALLEY,SUB_ALLEY,TONG,NUMBER,X,Y
彰化縣彰化市延平里30鄰延長街52巷1號,10007,1000701,1000701-047,30鄰,延長街,,52巷,,,,1號,120.54900324218,24.065826237835
彰化縣彰化市延平里30鄰延長街52巷8號,10007,1000701,1000701-047,30鄰,延長街,,52巷,,,,8號,120.54897033007,24.065198693865
彰化縣彰化市延平里30鄰延長街52巷37號,10007,1000701,1000701-047,30鄰,延長街,,52巷,,,,37號,120.54964188339,24.065165276895
彰化縣彰化市延平里30鄰延長街52巷39號,10007,1000701,1000701-047,30鄰,延長街,,52巷,,,,39號,120.54961793201,24.064955906901
彰化縣彰化市延平里30鄰延長街56號,10007,1000701,1000701-047,30鄰,延長街,,,,,,56號,120.54907458118,24.06584143674
彰化縣彰化市延平里30鄰延長街219號,10007,1000701,1000701-047,30鄰,延長街,,,,,,219號,120.55290602744,24.06508401394
