FULL_ADDR,COUNTY,TOWN,VILLAGE,NEIGHBORHOOD,ROAD,SECTION,LANE,ALLEY,SUB_ALLEY,TONG,NUMBER,X,Y
彰化縣芳苑鄉王功村15鄰漁港二路226號,10007,1000723,1000723-015,15鄰,漁港二路,,,,,,226號,120.33905681008,23.972844048484
彰化縣芳苑鄉王功村15鄰漁港二路266號,10007,1000723,1000723-015,15鄰,漁港二路,,,,,,266號,120.33925839723,23.973283347686
彰化縣芳苑鄉新寶村11鄰漁港二路325號,10007,1000723,1000723-020,11鄰,漁港二路,,,,,,325號,120.34009974391,23.976899787114
彰化縣芳苑鄉新寶村11鄰漁港二路326號,10007,1000723,1000723-020,11鄰,漁港二路,,,,,,326號,120.34023912099,23.97632939779
彰化縣芳苑鄉新寶村11鄰漁港二路329號,10007,1000723,1000723-020,11鄰,漁港二路,,,,,,329號,120.33988624979,23.976761092206
