FULL_ADDR,COUNTY,TOWN,VILLAGE,NEIGHBORHOOD,ROAD,SECTION,LANE,ALLEY,SUB_ALLEY,TONG,NUMBER,X,Y
彰化縣二林鎮萬興里9鄰功湖北路一段18號,10007,1000720,1000720-016,9鄰,功湖北路,1段,,,,,18號,120.40240477769,23.958776544065
彰化縣芳苑鄉草湖村4鄰功湖北路一段332號,10007,1000723,1000723-021,4鄰,功湖北路,1段,,,,,332號,120.38726475928,23.961387717559
彰化縣芳苑鄉建平村4鄰功湖北路一段262巷70弄11號,10007,1000723,1000723-023,4鄰,功湖北路,1段,262巷,70弄,,,11號,120.39195581355,23.964395972786
彰化縣芳苑鄉建平村7鄰功湖北路二段132巷176號,10007,1000723,1000723-023,7鄰,功湖北路,2段,132巷,,,,176號,120.37821867791,23.966130361855
彰化縣芳苑鄉建平村7鄰功湖北路二段132巷178號,10007,1000723,1000723-023,7鄰,功湖北路,2段,132巷,,,,178號,120.37822805495,23.966326334767
彰化縣芳苑鄉建平村7鄰功湖北路二段132巷180號,10007,1000723,1000723-023,7鄰,功湖北路,2段,132巷,,,,180號,120.37820374077,23.966499417461
彰化縣芳苑鄉新生村1鄰功湖北路二段193巷30號,10007,1000723,1000723-025,1鄰,功湖北路,2段,193巷,,,,30號,120.37426530691,23.961374568094
彰化縣芳苑鄉新生村1鄰功湖北路二段251號,10007,1000723,1000723-025,1鄰,功湖北路,2段,,,,,251號,120.37173993092,23.961108572313
