FULL_ADDR,COUNTY,TOWN,VILLAGE,NEIGHBORHOOD,ROAD,SECTION,LANE,ALLEY,SUB_ALLEY,TONG,NUMBER,X,Y
宜蘭縣冬山鄉南興村3鄰成興一路31巷20號,10002,1000208,1000208-008,3鄰,成興一路,,31巷,,,,20號,121.79322743547,24.636403298652
宜蘭縣冬山鄉南興村3鄰成興一路31巷28號,10002,1000208,1000208-008,3鄰,成興一路,,31巷,,,,28號,121.7930469117,24.636487039958
宜蘭縣冬山鄉南興村3鄰成興一路31巷30號,10002,1000208,1000208-008,3鄰,成興一路,,31巷,,,,30號,121.79307717171,24.636570843112
宜蘭縣冬山鄉南興村3鄰成興一路31巷32號,10002,1000208,1000208-008,3鄰,成興一路,,31巷,,,,32號,121.79308325898,24.636674545632
宜蘭縣冬山鄉南興村3鄰成興一路50號,10002,1000208,1000208-008,3鄰,成興一路,,,,,,50號,121.79352427759,24.636939184267
