FULL_ADDR,COUNTY,TOWN,VILLAGE,NEIGHBORHOOD,ROAD,SECTION,LANE,ALLEY,SUB_ALLEY,TONG,NUMBER,X,Y
雲林縣斗六市明德里18鄰河堤南路一段155號,10009,1000901,1000901-037,18鄰,河堤南路,1段,,,,,155號,120.55186205834,23.721560856217
雲林縣斗六市明德里18鄰河堤南路一段157號,10009,1000901,1000901-037,18鄰,河堤南路,1段,,,,,157號,120.55307107442,23.7213508012
雲林縣斗六市明德里18鄰河堤南路一段159號,10009,1000901,1000901-037,18鄰,河堤南路,1段,,,,,159號,120.5525655626,23.721186353462
雲林縣斗六市明德里3鄰河堤南路二段201號,10009,1000901,1000901-037,3鄰,河堤南路,2段,,,,,201號,120.53781512804,23.727336638497
雲林縣斗六市明德里12鄰河堤南路二段201之48號,10009,1000901,1000901-037,12鄰,河堤南路,2段,,,,,201之48號,120.54205735073,23.726425519133
雲林縣斗六市明德里3鄰河堤南路二段201之50號,10009,1000901,1000901-037,3鄰,河堤南路,2段,,,,,201之50號,120.54266497371,23.726335936427
