FULL_ADDR,COUNTY,TOWN,VILLAGE,NEIGHBORHOOD,ROAD,SECTION,LANE,ALLEY,SUB_ALLEY,TONG,NUMBER,X,Y
嘉義縣太保市安仁里10鄰學府路一段2號,10010,1001001,1001001-018,10鄰,學府路,1段,,,,,2號,120.29453407781,23.454190806478
嘉義縣太保市安仁里10鄰學府路一段6號,10010,1001001,1001001-018,10鄰,學府路,1段,,,,,6號,120.29450822032,23.45419430146
嘉義縣太保市安仁里8鄰學府路一段30號,10010,1001001,1001001-018,8鄰,學府路,1段,,,,,30號,120.29185959046,23.451320325913
嘉義縣朴子市大葛里27鄰學府路二段51號,10010,1001002,1001002-017,27鄰,學府路,2段,,,,,51號,120.28882955245,23.447902242527
嘉義縣朴子市大葛里27鄰學府路二段92號,10010,1001002,1001002-017,27鄰,學府路,2段,,,,,92號,120.28679593421,23.447679318166
