FULL_ADDR,COUNTY,TOWN,VILLAGE,NEIGHBORHOOD,ROAD,SECTION,LANE,ALLEY,SUB_ALLEY,TONG,NUMBER,X,Y
屏東縣內埔鄉內埔村35鄰埔興路36號,10013,1001313,1001313-001,35鄰,埔興路,,,,,,36號,120.5664213651,22.60811297804
屏東縣內埔鄉和興村13鄰埔興路1號,10013,1001313,1001313-006,13鄰,埔興路,,,,,,1號,120.5673752196,22.607354509358
屏東縣內埔鄉和興村13鄰埔興路99之1號,10013,1001313,1001313-006,13鄰,埔興路,,,,,,99之1號,120.56677589695,22.607247140066
屏東縣內埔鄉和興村13鄰埔興路103號,10013,1001313,1001313-006,13鄰,埔興路,,,,,,103號,120.56626517899,22.607886961793
屏東縣內埔鄉和興村13鄰埔興路131之1號,10013,1001313,1001313-006,13鄰,埔興路,,,,,,131之1號,120.56586424203,22.608102621893
屏東縣內埔鄉和興村13鄰埔興路135號,10013,1001313,1001313-006,13鄰,埔興路,,,,,,135號,120.56513630711,22.608373387623
屏東縣內埔鄉和興村13鄰埔興路137之1號,10013,1001313,1001313-006,13鄰,埔興路,,,,,,137之1號,120.56506501913,22.60840110026
