FULL_ADDR,COUNTY,TOWN,VILLAGE,NEIGHBORHOOD,ROAD,SECTION,LANE,ALLEY,SUB_ALLEY,TONG,NUMBER,X,Y
花蓮縣瑞穗鄉鶴岡村18鄰梧繞二街197號,10015,1001509,1001509-007,18鄰,梧繞二街,,,,,,197號,121.38900682063,23.527510363515
花蓮縣瑞穗鄉鶴岡村18鄰梧繞二街197之1號,10015,1001509,1001509-007,18鄰,梧繞二街,,,,,,197之1號,121.38898562632,23.527616392414
花蓮縣瑞穗鄉鶴岡村18鄰梧繞二街197之2號,10015,1001509,1001509-007,18鄰,梧繞二街,,,,,,197之2號,121.38875735631,23.527533344998
花蓮縣瑞穗鄉鶴岡村18鄰梧繞二街200號,10015,1001509,1001509-007,18鄰,梧繞二街,,,,,,200號,121.38882815921,23.528162549242
花蓮縣瑞穗鄉鶴岡村18鄰梧繞二街200之4號,10015,1001509,1001509-007,18鄰,梧繞二街,,,,,,200之4號,121.38863205911,23.527992733415
