FULL_ADDR,COUNTY,TOWN,VILLAGE,NEIGHBORHOOD,ROAD,SECTION,LANE,ALLEY,SUB_ALLEY,TONG,NUMBER,X,Y
屏東縣枋寮鄉東海村29鄰工業五街136號,10013,1001316,1001316-014,29鄰,工業五街,,,,,,136號,120.58230090074,22.405885199048
屏東縣枋寮鄉東海村29鄰工業五街136之1號,10013,1001316,1001316-014,29鄰,工業五街,,,,,,136之1號,120.58232801265,22.405848241032
屏東縣枋寮鄉東海村29鄰工業五街136之2號,10013,1001316,1001316-014,29鄰,工業五街,,,,,,136之2號,120.58233715609,22.405811236589
屏東縣枋寮鄉東海村29鄰工業五街136之3號,10013,1001316,1001316-014,29鄰,工業五街,,,,,,136之3號,120.58228834424,22.405796750805
屏東縣枋寮鄉東海村29鄰工業五街138號,10013,1001316,1001316-014,29鄰,工業五街,,,,,,138號,120.58224342449,22.405779926944
屏東縣枋寮鄉東海村29鄰工業五街256號,10013,1001316,1001316-014,29鄰,工業五街,,,,,,256號,120.5799940983,22.405149408125
屏東縣枋寮鄉東海村29鄰工業五街260號,10013,1001316,1001316-014,29鄰,工業五街,,,,,,260號,120.57971245138,22.405045358824
