FULL_ADDR,COUNTY,TOWN,VILLAGE,NEIGHBORHOOD,ROAD,SECTION,LANE,ALLEY,SUB_ALLEY,TONG,NUMBER,X,Y
屏東縣萬丹鄉崙頂村4鄰河堤南路626號,10013,1001305,1001305-011,4鄰,河堤南路,,,,,,626號,120.45761071262,22.594007906905
屏東縣萬丹鄉厦南村6鄰河堤南路751號,10013,1001305,1001305-013,6鄰,河堤南路,,,,,,751號,120.45663411541,22.59939388871
屏東縣萬丹鄉厦南村6鄰河堤南路755號,10013,1001305,1001305-013,6鄰,河堤南路,,,,,,755號,120.45660461786,22.599524736969
屏東縣萬丹鄉厦南村6鄰河堤南路757號,10013,1001305,1001305-013,6鄰,河堤南路,,,,,,757號,120.45658678309,22.599608212455
屏東縣萬丹鄉厦南村6鄰河堤南路759號,10013,1001305,1001305-013,6鄰,河堤南路,,,,,,759號,120.45657926003,22.599691180983
屏東縣萬丹鄉後村村1鄰河堤南路201巷9號,10013,1001305,1001305-024,1鄰,河堤南路,,201巷,,,,9號,120.45585247186,22.575987265775
