FULL_ADDR,COUNTY,TOWN,VILLAGE,NEIGHBORHOOD,ROAD,SECTION,LANE,ALLEY,SUB_ALLEY,TONG,NUMBER,X,Y
屏東縣佳冬鄉塭豐村10鄰十美路12之1號,10013,1001321,1001321-012,10鄰,十美路,,,,,,12之1號,120.53488006885,22.419585533688
屏東縣佳冬鄉塭豐村10鄰十美路66之1號,10013,1001321,1001321-012,10鄰,十美路,,,,,,66之1號,120.53235488824,22.418168839398
屏東縣佳冬鄉塭豐村10鄰十美路78之1號,10013,1001321,1001321-012,10鄰,十美路,,,,,,78之1號,120.53063384548,22.417155157188
屏東縣佳冬鄉塭豐村10鄰十美路90之1號,10013,1001321,1001321-012,10鄰,十美路,,,,,,90之1號,120.5300312056,22.416813110847
屏東縣佳冬鄉塭豐村10鄰十美路160號,10013,1001321,1001321-012,10鄰,十美路,,,,,,160號,120.5265122516,22.414737769637
屏東縣佳冬鄉塭豐村10鄰十美路181號,10013,1001321,1001321-012,10鄰,十美路,,,,,,181號,120.52723380745,22.415469149663
屏東縣佳冬鄉塭豐村10鄰十美路188號,10013,1001321,1001321-012,10鄰,十美路,,,,,,188號,120.52451133328,22.413645805608
