FULL_ADDR,COUNTY,TOWN,VILLAGE,NEIGHBORHOOD,ROAD,SECTION,LANE,ALLEY,SUB_ALLEY,TONG,NUMBER,X,Y
臺東縣鹿野鄉龍田村2鄰南四路17號,10014,1001405,1001405-007,2鄰,南四路,,,,,,17號,121.13151902779,22.898699154868
臺東縣鹿野鄉龍田村2鄰南四路239巷17弄17號,10014,1001405,1001405-007,2鄰,南四路,,239巷,17弄,,,17號,121.13151902779,22.898699154868
臺東縣鹿野鄉龍田村4鄰南四路159號,10014,1001405,1001405-007,4鄰,南四路,,,,,,159號,121.12596960664,22.898852523385
臺東縣鹿野鄉龍田村4鄰南四路161號,10014,1001405,1001405-007,4鄰,南四路,,,,,,161號,121.12526247827,22.898827416623
臺東縣鹿野鄉龍田村4鄰南四路42巷161號,10014,1001405,1001405-007,4鄰,南四路,,42巷,,,,161號,121.12526247827,22.898827416623
