FULL_ADDR,COUNTY,TOWN,VILLAGE,NEIGHBORHOOD,ROAD,SECTION,LANE,ALLEY,SUB_ALLEY,TONG,NUMBER,X,Y
高雄市左營區城南里6鄰埤仔頭路32巷7號,64,6400300,6400300-025,6鄰,埤仔頭路,,32巷,,,,7號,120.28983773501,22.681800717013
高雄市左營區城南里6鄰埤仔頭路32巷9號,64,6400300,6400300-025,6鄰,埤仔頭路,,32巷,,,,9號,120.28985515871,22.681818855507
高雄市左營區城南里6鄰埤仔頭路82巷12弄11號,64,6400300,6400300-025,6鄰,埤仔頭路,,82巷,12弄,,,11號,120.28968258133,22.682070946958
高雄市左營區城南里6鄰埤仔頭路82巷12弄13號,64,6400300,6400300-025,6鄰,埤仔頭路,,82巷,12弄,,,13號,120.28970514995,22.682034924655
高雄市左營區城南里6鄰埤仔頭路32巷15之1號,64,6400300,6400300-025,6鄰,埤仔頭路,,32巷,,,,15之1號,120.28989199894,22.681846110722
