FULL_ADDR,COUNTY,TOWN,VILLAGE,NEIGHBORHOOD,ROAD,SECTION,LANE,ALLEY,SUB_ALLEY,TONG,NUMBER,X,Y
高雄市鹽埕區藍橋里11鄰南興前街1號,64,6400100,6400100-001,11鄰,南興前街,,,,,,1號,120.28438234309,22.63352443755
高雄市鹽埕區藍橋里11鄰南興前街3號,64,6400100,6400100-001,11鄰,南興前街,,,,,,3號,120.28432967106,22.633551294472
高雄市鹽埕區藍橋里11鄰南興前街5號,64,6400100,6400100-001,11鄰,南興前街,,,,,,5號,120.28427593265,22.633596207923
高雄市鹽埕區藍橋里11鄰南興前街6號,64,6400100,6400100-001,11鄰,南興前街,,,,,,6號,120.28447465749,22.633732554452
高雄市鹽埕區藍橋里12鄰南興前街11號,64,6400100,6400100-001,12鄰,南興前街,,,,,,11號,120.28410596193,22.633730909079
高雄市鹽埕區藍橋里18鄰南興前街14之2號,64,6400100,6400100-001,18鄰,南興前街,,,,,,14之2號,120.2843086248,22.633858242738
高雄市鹽埕區藍橋里18鄰南興前街14之3號,64,6400100,6400100-001,18鄰,南興前街,,,,,,14之3號,120.28435040897,22.633867459851
高雄市鹽埕區藍橋里18鄰南興前街14之4號,64,6400100,6400100-001,18鄰,南興前街,,,,,,14之4號,120.28438922795,22.633885694374
高雄市鹽埕區藍橋里18鄰南興前街14之5號,64,6400100,6400100-001,18鄰,南興前街,,,,,,14之5號,120.28443402408,22.6338768636
