FULL_ADDR,COUNTY,TOWN,VILLAGE,NEIGHBORHOOD,ROAD,SECTION,LANE,ALLEY,SUB_ALLEY,TONG,NUMBER,X,Y
高雄市三民區安邦里1鄰同協路143巷12號,64,6400500,6400500-062,1鄰,同協路,,143巷,,,,12號,120.2922726929,22.648129962135
高雄市三民區安邦里1鄰同協路143巷13號,64,6400500,6400500-062,1鄰,同協路,,143巷,,,,13號,120.29227985569,22.648099199251
高雄市三民區安邦里1鄰同協路95之1號,64,6400500,6400500-062,1鄰,同協路,,,,,,95之1號,120.29511533636,22.648413136105
高雄市三民區安邦里1鄰同協路115號,64,6400500,6400500-062,1鄰,同協路,,,,,,115號,120.29471079602,22.648430682258
高雄市三民區安邦里1鄰同協路121號,64,6400500,6400500-062,1鄰,同協路,,,,,,121號,120.29432460422,22.648532202903
高雄市三民區安邦里1鄰同協路121之1號,64,6400500,6400500-062,1鄰,同協路,,,,,,121之1號,120.29408883914,22.648593566596
高雄市三民區安邦里1鄰同協路163號,64,6400500,6400500-062,1鄰,同協路,,,,,,163號,120.29349661349,22.648707091577
高雄市三民區安邦里1鄰同協路167號,64,6400500,6400500-062,1鄰,同協路,,,,,,167號,120.29310342087,22.648788440039
高雄市三民區安邦里1鄰同協路199號,64,6400500,6400500-062,1鄰,同協路,,,,,,199號,120.29271394279,22.648847317605
