FULL_ADDR,COUNTY,TOWN,VILLAGE,NEIGHBORHOOD,ROAD,SECTION,LANE,ALLEY,SUB_ALLEY,TONG,NUMBER,X,Y
高雄市前鎮區鎮北里1鄰東十五街1號,64,6400900,6400900-023,1鄰,東十五街,,,,,,1號,120.28824656316,22.606510390558
高雄市前鎮區鎮北里1鄰東十五街1之2號,64,6400900,6400900-023,1鄰,東十五街,,,,,,1之2號,120.28824656316,22.606510390558
高雄市前鎮區鎮北里1鄰東十五街1之3號,64,6400900,6400900-023,1鄰,東十五街,,,,,,1之3號,120.28824656316,22.606510390558
高雄市前鎮區鎮北里1鄰東十五街2號,64,6400900,6400900-023,1鄰,東十五街,,,,,,2號,120.28811058143,22.606454880996
高雄市前鎮區鎮北里1鄰東十五街2之2號,64,6400900,6400900-023,1鄰,東十五街,,,,,,2之2號,120.28811058143,22.606454880996
高雄市前鎮區鎮北里1鄰東十五街2之3號,64,6400900,6400900-023,1鄰,東十五街,,,,,,2之3號,120.28811058143,22.606454880996
