FULL_ADDR,COUNTY,TOWN,VILLAGE,NEIGHBORHOOD,ROAD,SECTION,LANE,ALLEY,SUB_ALLEY,TONG,NUMBER,X,Y
臺中市龍井區龍津里1鄰中圳路161巷20號,66,6602500,6602500-007,1鄰,中圳路,,161巷,,,,20號,120.52959008614,24.199811580322
臺中市龍井區龍津里1鄰中圳路161巷22號,66,6602500,6602500-007,1鄰,中圳路,,161巷,,,,22號,120.52956074597,24.199678941986
臺中市龍井區龍津里1鄰中圳路101號,66,6602500,6602500-007,1鄰,中圳路,,,,,,101號,120.53321393218,24.20069665483
臺中市龍井區龍津里20鄰中圳路423號,66,6602500,6602500-007,20鄰,中圳路,,,,,,423號,120.5238239385,24.202827675902
臺中市龍井區龍津里20鄰中圳路425號,66,6602500,6602500-007,20鄰,中圳路,,,,,,425號,120.52378004019,24.202836576865
臺中市龍井區龍津里20鄰中圳路427號,66,6602500,6602500-007,20鄰,中圳路,,,,,,427號,120.52372883917,24.202847694213
臺中市龍井區三德里13鄰中圳路2號,66,6602500,6602500-008,13鄰,中圳路,,,,,,2號,120.53729010341,24.200043187633
臺中市龍井區三德里13鄰中圳路198號,66,6602500,6602500-008,13鄰,中圳路,,,,,,198號,120.53077232325,24.201912152516
臺中市龍井區三德里13鄰中圳路200號,66,6602500,6602500-008,13鄰,中圳路,,,,,,200號,120.53095272619,24.202433689177
