FULL_ADDR,COUNTY,TOWN,VILLAGE,NEIGHBORHOOD,ROAD,SECTION,LANE,ALLEY,SUB_ALLEY,TONG,NUMBER,X,Y
臺中市大甲區福德里10鄰福順街51巷1號,66,6601100,6601100-028,10鄰,福順街,,51巷,,,,1號,120.61949678106,24.431647646065
臺中市大甲區福德里10鄰福順街51巷10號,66,6601100,6601100-028,10鄰,福順街,,51巷,,,,10號,120.62083184642,24.430625861239
臺中市大甲區福德里10鄰福順街51巷17號,66,6601100,6601100-028,10鄰,福順街,,51巷,,,,17號,120.62229520631,24.430128767295
臺中市大甲區福德里10鄰福順街51巷22號,66,6601100,6601100-028,10鄰,福順街,,51巷,,,,22號,120.62239964575,24.429726716507
臺中市大甲區福德里10鄰福順街35號,66,6601100,6601100-028,10鄰,福順街,,,,,,35號,120.61890452761,24.430955162083
