FULL_ADDR,COUNTY,TOWN,VILLAGE,NEIGHBORHOOD,ROAD,SECTION,LANE,ALLEY,SUB_ALLEY,TONG,NUMBER,X,Y
臺中市霧峰區北柳里25鄰霧工二路2號,66,6602600,6602600-010,25鄰,霧工二路,,,,,,2號,120.67904840031,24.061753414738
臺中市霧峰區北柳里25鄰霧工二路3號,66,6602600,6602600-010,25鄰,霧工二路,,,,,,3號,120.67942650711,24.061059881654
臺中市霧峰區北柳里25鄰霧工二路6號,66,6602600,6602600-010,25鄰,霧工二路,,,,,,6號,120.67906073687,24.061300507317
臺中市霧峰區北柳里25鄰霧工二路6之1號,66,6602600,6602600-010,25鄰,霧工二路,,,,,,6之1號,120.67902061429,24.061443783125
臺中市霧峰區南柳里8鄰霧工二路18號,66,6602600,6602600-011,8鄰,霧工二路,,,,,,18號,120.67851602256,24.059348297795
臺中市霧峰區南柳里8鄰霧工二路20號,66,6602600,6602600-011,8鄰,霧工二路,,,,,,20號,120.67866994383,24.059177802597
臺中市霧峰區南柳里8鄰霧工二路22號,66,6602600,6602600-011,8鄰,霧工二路,,,,,,22號,120.67852913801,24.058966227672
臺中市霧峰區南柳里8鄰霧工二路26號,66,6602600,6602600-011,8鄰,霧工二路,,,,,,26號,120.6784697075,24.058728873055
