FULL_ADDR,COUNTY,TOWN,VILLAGE,NEIGHBORHOOD,ROAD,SECTION,LANE,ALLEY,SUB_ALLEY,TONG,NUMBER,X,Y
臺南市柳營區東昇里29鄰奇美路一段458巷73號,67,6700400,6700400-004,29鄰,奇美路,1段,458巷,,,,73號,120.32685893948,23.275843789653
臺南市柳營區東昇里15鄰奇美路一段205巷292弄155之3號,67,6700400,6700400-004,15鄰,奇美路,1段,205巷,292弄,,,155之3號,120.32098762359,23.276385579777
臺南市柳營區東昇里15鄰奇美路一段205巷292弄155之5號,67,6700400,6700400-004,15鄰,奇美路,1段,205巷,292弄,,,155之5號,120.32100744967,23.276600850008
臺南市柳營區東昇里15鄰奇美路一段205巷292弄159之3號,67,6700400,6700400-004,15鄰,奇美路,1段,205巷,292弄,,,159之3號,120.32109875457,23.276386512059
臺南市柳營區東昇里29鄰奇美路一段588號,67,6700400,6700400-004,29鄰,奇美路,1段,,,,,588號,120.32547714101,23.277490886227
臺南市柳營區太康里6鄰奇美路二段236巷175號,67,6700400,6700400-007,6鄰,奇美路,2段,236巷,,,,175號,120.32990089287,23.284780512902
