FULL_ADDR,COUNTY,TOWN,VILLAGE,NEIGHBORHOOD,ROAD,SECTION,LANE,ALLEY,SUB_ALLEY,TONG,NUMBER,X,Y
臺南市安南區城北里8鄰安清路一段30之1號,67,6703500,6703500-028,8鄰,安清路,1段,,,,,30之1號,120.13362504128,23.058334816231
臺南市安南區城北里8鄰安清路一段30之22號,67,6703500,6703500-028,8鄰,安清路,1段,,,,,30之22號,120.13166748844,23.057313985274
臺南市安南區城南里10鄰安清路一段801巷35號,67,6703500,6703500-030,10鄰,安清路,1段,801巷,,,,35號,120.12509155214,23.050509605935
臺南市安南區城南里14鄰安清路一段801巷143號,67,6703500,6703500-030,14鄰,安清路,1段,801巷,,,,143號,120.12464537457,23.0478760814
臺南市安南區城南里14鄰安清路一段801巷145號,67,6703500,6703500-030,14鄰,安清路,1段,801巷,,,,145號,120.12465774468,23.04771343024
臺南市安南區城南里14鄰安清路二段641巷330號,67,6703500,6703500-030,14鄰,安清路,2段,641巷,,,,330號,120.11110484754,23.044821212167
臺南市安南區城南里2鄰安清路一段351之1號,67,6703500,6703500-030,2鄰,安清路,1段,,,,,351之1號,120.12837076295,23.054066445077
臺南市安南區城西里7鄰安清路三段500號,67,6703500,6703500-031,7鄰,安清路,3段,,,,,500號,120.09317107902,23.046922056426
