FULL_ADDR,COUNTY,TOWN,VILLAGE,NEIGHBORHOOD,ROAD,SECTION,LANE,ALLEY,SUB_ALLEY,TONG,NUMBER,X,Y
桃園市觀音區草新里33鄰二聖二街18巷1號,68,6801200,6801200-024,33鄰,二聖二街,,18巷,,,,1號,121.14089585849,25.038687401927
桃園市觀音區草新里33鄰二聖二街18巷3號,68,6801200,6801200-024,33鄰,二聖二街,,18巷,,,,3號,121.14083521289,25.038690348479
桃園市觀音區草新里33鄰二聖二街18巷5號,68,6801200,6801200-024,33鄰,二聖二街,,18巷,,,,5號,121.14078734782,25.038690393836
桃園市觀音區草新里33鄰二聖二街18巷7號,68,6801200,6801200-024,33鄰,二聖二街,,18巷,,,,7號,121.14073947616,25.038684661061
桃園市觀音區草新里33鄰二聖二街13號,68,6801200,6801200-024,33鄰,二聖二街,,,,,,13號,121.14120864066,25.038794722576
桃園市觀音區草新里33鄰二聖二街16號,68,6801200,6801200-024,33鄰,二聖二街,,,,,,16號,121.14098053547,25.038814259766
桃園市觀音區草新里33鄰二聖二街20號,68,6801200,6801200-024,33鄰,二聖二街,,,,,,20號,121.14097718812,25.038660149553
桃園市觀音區草新里33鄰二聖二街22號,68,6801200,6801200-024,33鄰,二聖二街,,,,,,22號,121.14097708843,25.038572936094
