FULL_ADDR,COUNTY,TOWN,VILLAGE,NEIGHBORHOOD,ROAD,SECTION,LANE,ALLEY,SUB_ALLEY,TONG,NUMBER,X,Y
桃園市桃園區汴洲里22鄰和愛街15巷3號,68,6800100,6800100-010,22鄰,和愛街,,15巷,,,,3號,121.30174607203,25.032099701077
桃園市桃園區汴洲里22鄰和愛街10之1號,68,6800100,6800100-010,22鄰,和愛街,,,,,,10之1號,121.30145885077,25.032688384958
桃園市桃園區汴洲里22鄰和愛街11號,68,6800100,6800100-010,22鄰,和愛街,,,,,,11號,121.30178762272,25.032355206827
桃園市桃園區汴洲里22鄰和愛街12之1號,68,6800100,6800100-010,22鄰,和愛街,,,,,,12之1號,121.30149944699,25.032594047551
桃園市桃園區汴洲里22鄰和愛街12之2號,68,6800100,6800100-010,22鄰,和愛街,,,,,,12之2號,121.30150746344,25.032549341389
桃園市桃園區汴洲里22鄰和愛街17號,68,6800100,6800100-010,22鄰,和愛街,,,,,,17號,121.30142928736,25.032106934526
桃園市桃園區汴洲里22鄰和愛街19號,68,6800100,6800100-010,22鄰,和愛街,,,,,,19號,121.30143136369,25.032105034379
