FULL_ADDR,COUNTY,TOWN,VILLAGE,NEIGHBORHOOD,ROAD,SECTION,LANE,ALLEY,SUB_ALLEY,TONG,NUMBER,X,Y
桃園市龍潭區佳安里2鄰淮子埔30之2號,68,6800900,6800900-015,2鄰,淮子埔,,,,,,30之2號,121.25073497623,24.853684259189
桃園市龍潭區佳安里3鄰淮子埔35號,68,6800900,6800900-015,3鄰,淮子埔,,,,,,35號,121.24716247956,24.854401838691
桃園市龍潭區佳安里4鄰淮子埔39之4號,68,6800900,6800900-015,4鄰,淮子埔,,,,,,39之4號,121.24695288032,24.852946880528
桃園市龍潭區佳安里4鄰淮子埔43號,68,6800900,6800900-015,4鄰,淮子埔,,,,,,43號,121.24371559407,24.852232443638
桃園市龍潭區佳安里4鄰淮子埔45之1號,68,6800900,6800900-015,4鄰,淮子埔,,,,,,45之1號,121.24359165428,24.851497363986
桃園市龍潭區佳安里5鄰淮子埔47之7號,68,6800900,6800900-015,5鄰,淮子埔,,,,,,47之7號,121.243704695,24.85010371939
