FULL_ADDR,COUNTY,TOWN,VILLAGE,NEIGHBORHOOD,ROAD,SECTION,LANE,ALLEY,SUB_ALLEY,TONG,NUMBER,X,Y
桃園市龍潭區大平里1鄰民有一街106號,68,6800900,6800900-018,1鄰,民有一街,,,,,,106號,121.24152186286,24.825205954235
桃園市龍潭區大平里1鄰民有一街108號,68,6800900,6800900-018,1鄰,民有一街,,,,,,108號,121.24152557189,24.825129025066
桃園市龍潭區大平里1鄰民有一街110號,68,6800900,6800900-018,1鄰,民有一街,,,,,,110號,121.24150511792,24.825039494964
桃園市龍潭區大平里1鄰民有一街112號,68,6800900,6800900-018,1鄰,民有一街,,,,,,112號,121.24149945644,24.824976846025
桃園市龍潭區大平里1鄰民有一街112之1號,68,6800900,6800900-018,1鄰,民有一街,,,,,,112之1號,121.24148672417,24.824839000746
